{
  "harness_id": "dad:harness:agent-instruction-red-team",
  "name": "Agent Instruction And Code Review Red Team",
  "version": "0.1.0",
  "path": "assets/coding-harnesses/agent-instruction-code-review-red-team",
  "family": "red_team",
  "status": "candidate",
  "languages": ["agent-instruction", "python", "rust", "mixed"],
  "repo_types": ["application", "library", "control_plane", "template_repo"],
  "domains": ["ai_engineering", "governance", "security"],
  "context_tags": ["red_team", "premortem", "code_review", "agent_instruction"],
  "task_types": ["review", "premortem", "agent_instruction_design", "security_review"],
  "capabilities": ["fresh_eyes_review", "premortem_prompt", "criticality_ranking"],
  "public_safe": true,
  "entrypoints": ["README.md", "harness.json", "prompts/README.md"],
  "research_questions": ["What failure story would make this agent guidance unsafe?", "Which tests would catch false green outcomes?"],
  "validation_commands": ["python -m pytest tests/test_mail_center.py -q"],
  "source_evidence": ["templates/load-bearing-decision-review.template.md", "docs/LOAD_BEARING_DECISION_REVIEW.md"],
  "review_status": "candidate",
  "authority_boundary": "Red-team findings are recommendations until implemented and validated."
}
