{
  "harness_id": "dad:harness:exception-learning-readiness",
  "name": "Exception Learning Readiness",
  "version": "0.1.0",
  "path": "assets/coding-harnesses/exception-learning-readiness",
  "family": "learning_capture",
  "status": "candidate",
  "languages": ["python", "agent-instruction"],
  "repo_types": ["control_plane", "governed_repo_family", "application", "library"],
  "domains": ["governance", "learning_loop", "exceptions_lake"],
  "context_tags": ["exception_learning", "fix_outcome", "promotion_gate", "synthetic_fixture"],
  "task_types": ["testing", "governance_review", "learning_loop", "exception_review"],
  "capabilities": [
    "learning_readiness_eval",
    "mixed_evidence_false_green_check",
    "sample_size_threshold_gate",
    "fix_outcome_validation_gate",
    "public_private_release_gate",
    "backfill_promotion_boundary"
  ],
  "public_safe": true,
  "entrypoints": [
    "README.md",
    "harness.json",
    "examples/synthetic-learning-readiness-scenarios.json",
    "tests-or-evals/minimum-eval.json"
  ],
  "research_questions": [
    "Can a single validated fix hide unresolved siblings in the same event-type cluster?",
    "Can one-off validated fixes bypass the production comparable-event threshold?",
    "Can malformed or legacy fix-outcome rows count as validated evidence?",
    "Can backfill-only or non-public-origin evidence look promotion-ready?"
  ],
  "validation_commands": [
    "python -m pytest tests/test_exceptions_lake.py -q",
    "python -m digital_asset_directory.cli exceptions learning-check --scenarios assets/coding-harnesses/exception-learning-readiness/examples/synthetic-learning-readiness-scenarios.json"
  ],
  "source_evidence": [
    "docs/DAD_EXCEPTIONS_LAKE_BUILDOUT.md",
    "src/digital_asset_directory/exceptions_lake.py",
    "processed/reports/exception_learning_queue.md"
  ],
  "review_status": "candidate",
  "authority_boundary": "The harness checks supplied synthetic learning-readiness cases only. It does not promote lessons, prove real repo completeness, or override source authority."
}
